question,response
How do I find out what late payment charges I will have to pay if I fail to repay my loan on time?,"Information on the estimated late payment penalty on a loan may be obtained personally at the branch, while the terms and conditions of accrual and the amount of the penalty stipulated by the credit programme are specified in the respective consumer loan passport and in your loan agreement."
How do I renew my card?,"To renew a payment card that will soon expire, make an Application on the bank's site or visit any branch or the Head Office of Pivdenny Bank and complete the documents provided by the bank employee.
To receive your card, you will have to provide:

a passport or another ID;
proof of your personal taxpayer ID number."
How do I repay the loan?,"In the internet bank, go to ""My accounts/loans"", select the required loan from the list and press the ""Repay"" button. Enter the required repayment amount and authorise the payment using the code received by SMS message."
How do I repay the loan?,"You can make payments by any means at your convenience:

via Pivdenny MyBank, a system of remote services for individual clients;
by money transfer;
by card-to-account transfer;
personally, at any bank branch.

The priority is to pay instalments in a timely fashion."
How do I repay the loan?,"You can make payments by any means at your convenience:

via the Pivdenny MyBank system of remote services for individual clients;
by money transfer;
by card-to-account transfer;
personally, at any bank branch.

The priority is to pay instalments in a timely fashion."
How do I repay/close a bill?,A bill is deemed closed if documentary evidence exists to confirm its repayment.
How do I replenish my card account?,"You can replenish your card account in any manner convenient to you, including:

by way of fund transfers:
via the Pivdenny MyBank system;
card-to-card transfer;
by money transfer;
at bank branches.

To replenish your card account at a Pivdenny Bank branch, you need to know the number of the card or card account, specified in the account agreement. To do so, you need to have a passport or another ID."
How do I replenish my mobile phone account balance?,"Within internet-banking system, go to ""Bill Payment/Pay a bill/ Mobile operators"", select the necessary organisation in the catalogue and perform the payment."
"How do I transfer cash from/to a ""Saving account""?","Within the internet banking system, go to ""My accounts"", select the required ""Saving account"" in the list of card accounts and press ""Replenish account"" or ""Credit from account"", and enter the necessary amount. Authorise the payment using the code received by SMS message."
How do I update my personal data?,"— code word:To update a code word, visit the nearest bank branch.— surname and name/passport details/registration address/actual residence address:To update information, visit the nearest bank branch.— phone number:To update your phone number, visit the nearest bank branch.— phone number in the Pivdenny MyBank internet banking system:To update the phone number in the Pivdenny MyBank internet banking system, visit the nearest bank branch."
How do I update my phone number in the Pivdenny MyBank internet banking system?,"To update your phone number in the Pivdenny MyBank internet banking system, visit your nearest bank branch."
How fast are POS terminals are connected?,Within 3 business days from the moment of signing the acquiring agreement.
How is my borrowing power evaluated?,"The loan amount (up to UAH 200,000) is assessed based on the client’s category and his/her income."
How is my borrowing power evaluated?,"The loan amount is assessed based on the market (estimated) value of the mortgaged property acquired by the borrower and his/her income, which should be enough to repay the loan while being able to afford basic expenses and must not exceed 70 % of the market value of the mortgaged property."
How is the fee deducted?,The fee is deducted by the bank from the merchant daily from the total amount.
How is the loan amount determined?,Based on the financial position of the borrower and deposit amount.
How is the loan amount determined?,On the financial position of the borrower and deposit amount.
How is the loan amount determined?,"The amount of the loan depends on the borrower’s financial situation, the type and value of collateral, as well as from whom the borrower buys fixed assets (from a bank partner or an external seller)."
How is the loan amount determined?,"The amount of the loan depends on the permissible level of debt, which is determined by the terms of the loan agreement."
How is the loan amount determined?,"The amount of the overdraft limit depends on several parameters:

Type of collateral.
Duration of client relationship with Pivdenny Bank.
Volumes of the average net monthly income from business to the current account in the bank/other banks."
How is the loan amount determined?,"The loan amount depends on the financials of the borrower, the type and value of collateral and other factors."
How is the loan amount determined?,"The loan amount depends on the financials of the borrower, the type and value of collateral and the total cost of the investment project. The maximum possible loan amount is 80% of the total cost of the investment project."
How long after opening a package can I begin to use the products in the package?,On the day the package is opened.
How long does it take to open an escrow account?,The bank opens an escrow account during one business day.
How long does it take to open an escrow account?,The escrow account is opened within one business day.
How long does it take to process payment receipt on the website?,"That depends on the website platform. On average, integration takes 1-2 days."
How long does it take to receive a card?,"According to the internal regulations of the Bank,you will receive your card within 5 business days, once your application is completed and the service fees have been paid. The bank’s employees will do their best to ensure that you receive your card in even less time if possible.
In our Head Office, you can order express card issuance, within 4 business hours. This service is available at an extra charge."
How long does it take to review a loan application?,Up to 5 business days from the time the borrower submits all documents to the bank.
How long does it take to review a loan application?,Up to 7 business days from the moment the documents are submitted to the bank by the borrower.
How long does it take to review a loan application?,Up to 7 business days from the time the borrower submits all documents to the bank.
How many ingots may be exported?,"An individual may export bank metals worth below EUR 10,000 (or the equivalent) outside Ukraine without declaring them (in a written form). If their value is equal to or exceeds EUR 10,000 (or the equivalent), bank metals should be declared."
How many tranches can be opened within the scope of one deposit line?,The number of contributions (tranches) on a single deposit account is unlimited. The accrual of interest on each contribution (tranche) is carried out separately.
How much time does the bank require to decide whether to issue a guarantee?,Up to 5 working days from the time the full package of documents is submitted by the client.
How often can I increase my deposit?,This option is not available.
How often can I replenish my deposit?,This option is not available.
How quickly can a package be opened?,A package is opened within one business day.
How quickly will the account be opened?,The bank opens the account within one working day.
How soon will a transfer reach the recipient?,"The speed of the transfer to the recipient depends on the selected payment system. For example, Western Union, Ria and Welsend systems process pay-outs of transfers upon receipt by the sender of a control number (on average) in 5-30 minutes. On sending of a transfer via MoneyGram, the money is accessible for receipt within several minutes, and the MONEGO system ensures instant crediting of the funds to the payment card. In the case of S.W.I.F.T., the time frame for money delivery may be up to 5 working days."
How soon will the account be opened?,The bank opens a current account during one business day.
"If my card expires, how can I order a new one?","Visit the branch that serves you, present your passport and IDN, to fill out an application form for a new card in the month of the year indicated on the front of your corporate card."
In what regions is the cash collection available?,"Cash collection service is accessible in 25 Ukrainian regions. Cash collection units are represented in cities such as: Kyiv, Odessa, Kherson, Mykolaiv and Dnipro."
In which regions is the cash collection service available?,"Cash collection is available in 25 regions of Ukraine. Cash collection units are represented in cities such as: Kyiv, Odesa, Kherson, Mykolaiv and Dnipro."
Is Pivdenny Bank a member of the Individual Deposit Guarantee Fund?,"Pivdenny Bank is a participant in the Individual Deposit Guarantee Fund of Ukraine (certificate No. 016 dated 16.10.2012). The Fund guarantees reimbursement of individual deposits in full, which, however, is capped at the amount of UAH 200,000 (resolution of the Administrative Board of the Individual Deposit Guarantee Fund Resolution No. 27 dated 21.08.2012."
Is an adapted repayment schedule possible and for what period?,Yes. The client is given the opportunity to make a minimum of 3 payments per year on the loan principal. The payment period is chosen by the client.
Is it possible to cancel a card-to-card transfer?,"Unfortunately, there is no such possibility.
Before confirming the transfer, you must carefully check that the specified card number of the recipient is correct."
Is it possible to conclude a deposit agreement without opening a current account?,Yes.
Is it possible to conclude the deposit agreement without opening a current account?,This deposit requires the opening of a current account.
Is it possible to conclude the deposit agreement without opening a current account?,Yes.
Is it possible to connect online acquiring without opening a current account in your bank?,Opening a current account with Pivdenny Bank is not required under this service. But it is recommended to expand service opportunities and develop your business.
Is it possible to connect several FDs to one terminal?,"Yes. Several FDs can be connected to one terminal. For this purpose, each FD needs to conclude an acquiring agreement with the bank."
Is it possible to issue a notarised power of attorney to manage an escrow account?,"It is possible, and should be properly issued taking into account the specifics of the escrow account."
Is it possible to make agreements with non-residents on an escrow account?,No. The only permitted legal status of the client is “resident of Ukraine”.
Is it possible to make multiple deposit agreements in different currencies at one time?,"Yes, by signing the respective deposit agreements."
Is it possible to replenish a deposit when in another country?,A deposit may be increased via the Pivdenny MyBank system from anywhere.
Is it possible to ship coins to another city?,Please contact the bank’s support services to discuss the possibility and terms of shipping.
Is it possible to switch to another package?,"Yes, it is possible to switch to another package."
Is the interest on a deposit taxable?,"Yes, the interest earned on a deposit is subject to tax irrespective of the amount and currency of the deposit: already since 2016 interest is taxed at 18 % plus military duty of 1.5 %.
Note that it is the interest and not the principal that is subject to taxation."
My card was forfeited by an ATM of Pivdenny Bank. What do I do next?,"In case of forfeiture of the card:

block your card temporary via Pivdenny MyBank system or call the Customer Support Center of the bank at 0 800 30 70 30 (free of charge all over Ukraine) to block the card by way of its putting on the STOP-list. After receiving the cardholder’s request by phone, the card will be blocked by putting it on the electronic STOP list. Once the card is blocked, no transactions will be allowed using the card;
visit a bank branch and complete an application for issuance of the card or file an application for issue of the card forfeited by the ATM via the Pivdenny MyBank system - Personal cabinet in the section ""Application for services"". If required, re-issue the card by making such a request at a bank branch.

The card will be returned to the holder after the regular receipt of funds from the ATM."
My card was forfeited by another bank’s ATM. What do I do next?,"If your card was forfeited by another bank’s ATM, visit a branch of Pivdenny bank and obtain a statement that your bank has no objections to the return of your card. Provide this statement at a branch or the head office of the forfeiting bank."
Should a plastic box with a coin be opened?,"No. There is a risk of leaving fingerprints and dust particles on the glazed surface of the coin, which leads to deterioration of the coin’s appearance."
What are the deadlines for salary payment to employees?,"In line with the salary project agreement, but no later than the next business day from the time the organisation transfers the funds (subject to the availability of funds on the account)."
What are the device requirements to operate Google Pay?,"Google Pay can be used on smartphones starting from the Android 4.4 version, which support NFC technology, without unlocked root access.
Google Pay is also accessible on models of smartwatches that support the contactless NFC-payment feature."
What are the device requirements to operate Tap For Pay?,Tap For Pay is accessible for smartphones with Android 4.4 or an older version supporting NFC technology without unlocked root-access.
What are the reasons for a failed transfer?,"Insufficient funds on your card;
Expired card;
The authorisation request is forbidden by the payment gate.It is likely that your card does not have CVC2/CVV2 code verification. Contact your issuing bank. You will be able to enable CVV2/CVC2 code verification. The help desk phone is usually indicated on the back of the card.
The transaction is not authorised by the issuing bank.

This message indicates that the bank that issued the card declined the transfer. This is most often due to card restrictions related to online transactions. To resolve this issue, contact the bank that issued your card and set the required payment limit.
There may also be a restriction imposed by the issuer in compliance with legal requirements, for example, the card for replenishment may not be a card opened in a foreign currency."
What are the requirements for the website by the bank?,"The website must contain all of the necessary content 
Indication of the company's full contact information – legal and correspondence address, phone, e-mail. Detailed description of the list of services provided, terms of delivery and payment.
The goods and services provided by the organisation must not contradict the law and ethic norms. A detailed description of the offered goods and services should be posted on the seller's website. Price, product/service characteristics, equipment and warranty conditions must be specified.
The buyer must be able to read the terms and conditions of return or service cancellation.
The website must include a page explaining the policy of non-disclosure and protection of personal information of the client.
The request for card details must be made after switching to the payment service (if the website does not have a PCI DSS certificate).
According to the rules of the international payment systems Visa and MasterCard, it is necessary that their logos be placed on the main page of the website. The logo placement indicates that it is possible to make a payment using bank cards. This increases customer loyalty and improves website conversion. In addition, a separate section of the website should contain payment instructions, which explains to the buyer the non-cash payment procedure in the store."
What are the terms of crediting funds to the current account?,The transaction is processed on the next banking day following close of business. Detailed conditions are specified in the Internet acquiring agreement.
What are the time frames for gift delivery?,"The term of delivery depends on the gift selected.
Tangible gifts are delivered by mail or courier within 14 days.
For instant gifts, you will receive a message with the relevant electronic certificate number. In exceptional cases, delivery may take up to 2 business days."
What are the time frames for review of the loan application?,Up to 20 business days from the time the borrower submits all documents to the bank.
What are the time frames for review of the loan application?,Up to 3 working days from the moment the documents are submitted to the bank by the borrower.
What are the time frames for review of the loan application?,Up to 7 business days from the time the borrower submits all documents to the bank.
What are the time frames of review of the loan application?,Up to 7 working days from the moment of submission by the potential borrower of full documents package for unsecured overdraft and up to 14 working days for secured financing.
What are the variants of the repayment schedule?,The interest is paid on a monthly basis. According to the signed overdraft agreement Repayment after every 30 days is the most common schedule.
What can be collateral for a loan?,"The collateral may be any immovable/movable property and acquired current assets, as an additional pledge."
What can be used as collateral to secure the loan?,1. Immovable/movable property.2. Property rights to funds placed on a deposit account in Pivdenny Bank.3. Guarantee from a solvent legal entity.4. Guarantee from beneficiary owners.
What can be used as collateral to secure the loan?,"Immovable/movable property.
Property rights to funds placed on a deposit account in Pivdenny Bank.
Guarantee from a solvent legal entity.
Guarantee from beneficiary owners."
What can be used as collateral to secure the loan?,"Immovable/movable property.
Property rights to funds placed on a deposit account with Pivdenny Bank.
Goods in circulation as additional collateral."
What can be used as collateral to secure the loan?,"Immovable/movable property.
Property rights to funds placed on a deposit account with Pivdenny Bank.
Transport, agricultural machinery.
Goods in circulation as additional collateral."
What can be used as collateral to secure the loan?,"Property rights to receive cash flows/expected borrower cash flows that are generated as a result of the investment project.
An asset/object created as a result of the investment project.
Special-purpose company corporate rights.
Property rights to funds held on deposit accounts in banks."
What can be used as collateral to secure the loan?,"Purchased fixed assets followed by their use in economic activities.
Immovable/movable property.
Funds in a deposit account with Pivdenny Bank.
Goods in circulation as additional collateral."
What can be used as collateral to secure the loan?,"Purchased fixed assets followed by their use in economic activities.
Immovable/movable property.
Property rights to funds placed on a deposit account with Pivdenny Bank.
Goods in circulation as additional collateral."
What coins does the bank purchase?,It purchases only bullion coins of the National Bank of Ukraine (the Archistratigus Michael).
"What currency will be debited from my card account, if I pay for a product in euros using my UAH payment card?","The amount in EUR will be converted into UAH, applying the exchange rate fixed by the Bank for payment card-based transactions on the day the funds are debited. The funds will be credited from the account in UAH plus the applicable currency conversion fee.
In any case, the funds are debited in the currency, in which your card account is denominated."
What days of the week is the cash collection service available?,All days except for 1 January.
What days of the week is the cash collection service available?,"Every day, except for 1 January."
What do I do if my card is lost?,"If you lose your payment card or it is stolen – contact Customer Support Center of the bank IMMEDIATELY by calling 0 800 30 70 30 (free of charge within Ukraine). After reporting the circumstances surrounding the loss or theft, you will have to provide information enabling us to identify you as the cardholder, i.e. the code word specified in the application for the card issuance; it will also help if you know the card number, your passport details, and the number of your individual taxpayer ID card. This will allow the bank employee to easily and quickly identify the card that needs to be deactivated.
If you are unable to provide the above information in full, the bank employee will ask you several additional questions. After that, the card will be put on the electronic STOP list.
The bank’s client support service phone number is specified on the reverse side of the card. We recommend that you add it to your mobile phone address book.
Using the Pivdenny MyBank system you can block your card online in case of loss or suspicions regarding unauthorised use of your funds.
In case of unforeseen situations or questions regarding transactions with payment cards, you may contact the bank's Customer Support Center 24 hours a day:

in Ukraine, at 0 800 30 70 30 (calls are free of charge all over Ukraine);
from abroad at +380 482 30 70 30 (the call may be billed by the operator);
via Skype - using the contact name pivdenny_bank or from the website <link>
via Pivdenny MyBank system - Personal cabinet - Messages - Create a message;
via the e-mail address 307030@pivdenny.ua;
using the feedback form - refer to the footer on the bank website.

After your call on a branch of the bank we will take steps to manufacture a new card in lieu of the lost one based on your application."
What documents serve to confirm the reason for a S.W.I.F.T.-transfer outside Ukraine?,"agreements (contracts);
invoices;
claim forms, invitations;
letters-settlements or letters-notifications from non-resident legal entities;
letters from attorneys or notaries of foreign states."
What documents should be presented to remit or receive a transfer?,"To send a transfer in an amount below UAH 400,000.00/day (or the equivalent), the sender should provide a passport or another ID. To send a transfer in an amount that exceeds UAH 400,000.00/day (or the equivalent), the sender should provide supporting documents (as defined in the effective regulations of the NBU).
To receive a transfer in an amount below UAH 400,000.00/day (or the equivalent), the recipient should provide a passport. In all other cases, the recipient should provide a passport or another ID, and original proof of the personal taxpayer ID number."
What documents should be provided to send or receive a transfer?,"To send a transfer in an amount below UAH 400,000.00/day (or the equivalent), the sender has to provide a passport or another ID. To send a transfer in an amount over UAH 400,000.00/day (or the equivalent), the sender must provide supporting documents (as defined in the effective regulations of the NBU).To receive a transfer in an amount below UAH 400,000.00/day (or the equivalent), the recipient should provide a passport. In all other cases, the recipient must provide a passport or another ID, and proof of the personal taxpayer ID number."
What documents should be provided to send or receive a transfer?,"To send a transfer in an amount below UAH 400,000.00/day (or the equivalent), the sender should provide a passport or another ID. To send a transfer in an amount over UAH 400,000.00/day (or the equivalent), the sender has to provide supporting documents (as defined in the effective regulations of the NBU).To receive a transfer in an amount below UAH 400,000.00/day (or the equivalent), the recipient must provide a passport. In all other cases, the recipient must provide a passport or another ID, and proof of the personal taxpayer ID number."
What documents should be provided to send or receive a transfer?,"To send a transfer in an amount below UAH 400,000.00/day (or the equivalent), the sender should provide a passport or another ID. To send a transfer in an amount over UAH 400,000.00/day (or the equivalent), the sender should provide supporting documents (as defined in the effective regulations of the NBU).To receive a transfer in an amount below UAH 400,000.00/day (or the equivalent), the recipient should provide a passport. In all other cases, the recipient should provide a passport or another ID, and proof of the personal taxpayer ID number."
What information should be given by a client to send a transfer from Pivdenny Bank?,"The amount and the currency of the transfer.
Select a transfer system.
Country of the recipient of the transfer.
Recipient’s details.
Other information depending on the country of destination and selected transfer system."
What is NFC?,"Near Field (between 3 - 5 cm) Communication technology enables contactless data exchange between mobile phones, smart-cards, payment terminals, access control systems and other devices."
"What is a ""commemorative/jubilee/investment coin""?","Commemorative/jubilee coins are 5-10 times more expensive than their materials. The production price of investment coins is 1-10% more than the cost of its precious metal. The mintage of commemorative coins is limited, whereas investment coin mintage is unlimited."
